{
  "schemaVersion": 1,
  "status": "active",
  "startedAt": "2026-10-04T09:00:00Z",
  "pausedAt": null,
  "repo": {
    "remoteUrl": "git@github.com:example/app.git",
    "owner": "example",
    "name": "app"
  },
  "branch": "fix/login-retry",
  "worktreePath": "/Users/me/conductor/workspaces/app/lisbon",
  "firstSeenHead": "1111111111111111111111111111111111111111",
  "pr": {
    "number": 42,
    "url": "https://github.com/example/app/pull/42"
  },
  "lastIngest": {
    "at": "2026-10-04T16:00:00Z",
    "head": "5555555555555555555555555555555555555555"
  },
  "remoteCheck": {
    "at": "2026-10-04T17:00:00Z",
    "newSourceCount": 2
  },
  "lastViewedAt": "2026-10-04T15:00:00Z",
  "applier": {
    "state": "idle"
  },
  "nextFindingNumber": 6,
  "createdAt": "2026-10-04T09:00:00Z",
  "updatedAt": "2026-10-04T16:05:00Z"
}
